{
  "name": "ISEC Custom Theme",
  "version": "1.0.0",
  "description": "Tema personalizado para o Assistente Virtual ISEC",
  "colors": {
    "primary": "#007aff",
    "primaryHover": "#8779e7",
    "secondary": "#EDEEF2",
    "background": "#ffffff",
    "text": "#666",
    "textLight": "#757575",
    "white": "#fff",
    "border": "#E4E7EC",
    "gradient": {
      "start": "#9059f7",
      "end": "#de6af7"
    }
  },
  "typography": {
    "fontFamily": "RobotoRegular, sans-serif",
    "fontSize": "16px",
    "lineHeight": "22.5px",
    "fontWeight": "400"
  },
  "container": {
    "width": "350px",
    "height": "85vh",
    "borderRadius": "15px",
    "boxShadow": "0px 4px 6px 0px rgba(0, 0, 0, 0.25)",
    "zIndex": "1004",
    "position": {
      "bottom": "20px",
      "right": "20px"
    }
  },
  "header": {
    "backgroundColor": "#007aff",
    "textColor": "#fff",
    "height": "65px",
    "borderRadius": "15px 15px 0 0",
    "padding": "15px 20px",
    "botName": "ISEC Virtual Assistant Joaquim",
    "avatar": {
      "width": "35px",
      "height": "35px",
      "borderRadius": "50%",
      "border": "2px solid #fff",
      "image": "https://api.dicebear.com/7.x/bottts/svg?seed=mlops&backgroundColor=C8941D"
    },
    "title": {
      "text": "ISEC Virtual Assistant Joaquim",
      "fontSize": "17px",
      "fontWeight": "600",
      "color": "#fff"
    }
  },
  "messages": {
    "container": {
      "backgroundColor": "#fff",
      "padding": "15px 3px 10px 20px"
    },
    "local": {
      "backgroundColor": "#007aff",
      "textColor": "#ffffff",
      "borderRadius": "15px 15px 0 15px",
      "padding": "10px",
      "boxShadow": "0px 4px 4px -3px rgba(0, 0, 0, 0.25)"
    },
    "remote": {
      "backgroundColor": "#edeef2",
      "textColor": "#666",
      "borderRadius": "15px 15px 15px 0",
      "maxWidth": "303px",
      "padding": "10px",
      "boxShadow": "0px 4px 4px -3px rgba(0, 0, 0, 0.25)"
    },
    "loading": {
      "dotColor": "#007aff"
    }
  },
  "buttons": {
    "backgroundColor": "#007aff",
    "hoverBackgroundColor": "#8779e7",
    "textColor": "#ffffff",
    "borderRadius": "6px",
    "padding": "0.25rem 0.5rem",
    "lineHeight": "21px",
    "transition": "color 0.15s ease-in-out, background-color 0.15s ease-in-out, border-color 0.15s ease-in-out, box-shadow 0.15s ease-in-out"
  },
  "cards": {
    "backgroundColor": "#edeef2",
    "textColor": "#666",
    "borderRadius": "15px",
    "boxShadow": "0 2px 4px 0px rgba(0, 0, 0, 0.25)",
    "padding": "15px",
    "image": {
      "height": "168px"
    },
    "swiper": {
      "width": "275px",
      "height": "350px",
      "buttonSize": "30px",
      "buttonTop": "155px"
    }
  },
  "footer": {
    "backgroundColor": "#EDEEF2",
    "borderRadius": "0 0 15px 15px",
    "height": "55px",
    "padding": "15px"
  },
  "input": {
    "backgroundColor": "transparent",
    "textColor": "#757575",
    "borderRadius": "50px 0px 0px 50px",
    "padding": "2px",
    "margin": "0px 13px 0 20px"
  },
  "micButton": {
    "size": "40px",
    "borderRadius": "50%",
    "background": "linear-gradient(90deg, #9059f7 3%, #de6af7 100%)",
    "marginRight": "10px",
    "iconSize": "24px",
    "hoverTransform": "scale(1.1)"
  },
  "sendButton": {
    "backgroundColor": "#007aff",
    "hoverBackgroundColor": "#8779e7",
    "iconSize": "15px",
    "margin": "5px 5px 0 10px"
  },
  "toggleButton": {
    "width": "56px",
    "height": "56px",
    "borderRadius": "50%",
    "boxShadow": "0 8px 24px rgba(0,0,0,0.25)",
    "fontSize": "22px",
    "position": {
      "right": "24px",
      "bottom": "24px"
    },
    "zIndex": "10000"
  },
  "popup": {
    "width": "380px",
    "height": "560px",
    "maxWidth": "95vw",
    "maxHeight": "85vh",
    "borderRadius": "16px",
    "border": "1px solid #E4E7EC",
    "boxShadow": "0 10px 25px rgba(0,0,0,0.25)",
    "position": {
      "right": "24px",
      "bottom": "92px"
    },
    "zIndex": "9999"
  },
  "minimized": {
    "backgroundImage": "https://webchat-themes.ng.botschool.ai/private-themes/botschool2.0/images/default_student.jpg",
    "boxShadow": "0px 5px 2px rgba(0, 0, 0, 0.25)",
    "position": {
      "bottom": "70px",
      "right": "25px"
    }
  },
  "icons": {
    "minimize": "https://webchat-themes.ng.botschool.ai/private-themes/botschool2.0/icons/minimize.svg",
    "close": "https://webchat-themes.ng.botschool.ai/private-themes/botschool2.0/icons/close.svg",
    "send": "https://webchat-themes.ng.botschool.ai/private-themes/botschool2.0/icons/send.svg",
    "mic": "https://webchat-themes.ng.botschool.ai/private-themes/botschool2.0/icons/mic.svg",
    "file": "https://webchat-themes.ng.botschool.ai/private-themes/botschool2.0/icons/file.png",
    "left": "https://webchat-themes.ng.botschool.ai/private-themes/botschool2.0/icons/left.svg",
    "right": "https://webchat-themes.ng.botschool.ai/private-themes/botschool2.0/icons/right.svg"
  },
  "customCSS": "/* HOST STYLES - Styles for elements outside shadow DOM */\n.chat-toggle-btn {\n  position: fixed;\n  right: 24px;\n  bottom: 24px;\n  width: 56px;\n  height: 56px;\n  border-radius: 50%;\n  border: none;\n  cursor: pointer;\n  z-index: 10000;\n  box-shadow: 0 8px 24px rgba(0,0,0,0.25);\n  color: #fff;\n  font-size: 22px;\n  transition: all 0.3s ease;\n}\n\n.chat-popup {\n  position: fixed;\n  right: 24px;\n  bottom: 92px;\n  width: 380px;\n  height: 560px;\n  max-width: 95vw;\n  max-height: 85vh;\n  background: #ffffff;\n  border: 1px solid #E4E7EC;\n  border-radius: 16px;\n  box-shadow: 0 10px 25px rgba(0,0,0,0.25);\n  overflow: hidden;\n  z-index: 9999;\n}\n\n/* SHADOW DOM STYLES START */\n* {\n  font-size: 16px;\n  line-height: 22.5px;\n  font-weight: 400;\n}\n* p {\n  margin-block-start: 0;\n  margin-block-end: 0;\n}\n\n#bsc-chat-container {\n    width: 350px;\n    z-index: 1004;\n    bottom: 20px;\n    right: 20px;\n    height: 85vh;\n    border-radius: 15px;\n    box-shadow: 0px 4px 6px 0px rgba(0, 0, 0, 0.25);\n}\n#bsc-chat-container * {\n  font-family: \"RobotoRegural\", sans-serif;\n}\n#bsc-chat-container a {\n  color: #007aff;\n}\n#bsc-chat-container a:hover, #bsc-chat-container a:active, #bsc-chat-container a:visited {\n  color: #8779e7;\n}\n#bsc-chat-container.bsc-chat-container-minimized .bsc-header {\n  display: none;\n  outline: auto;\n}\n#bsc-chat-container .bsc-header {\n  flex: 65px 0 0;\n  background-color: #007aff;\n  padding: 15px 20px;\n  border-radius: 15px 15px 0 0;\n}\n#bsc-chat-container .bsc-header-details {\n  align-items: center;\n}\n#bsc-chat-container .bsc-header-details-image {\n  border-radius: 50%;\n  background-image: url(\"https://webchat-themes.ng.botschool.ai/private-themes/botschool2.0/images/default_student.jpg\");\n  background-repeat: no-repeat, no-repeat;\n  background-size: cover;\n  background-position: 50% 50%;\n  border: 2px solid #fff;\n  width: 35px;\n  height: 35px;\n}\n#bsc-chat-container .bsc-header-details-text {\n  padding-left: 10px;\n  padding-top: 2px;\n}\n#bsc-chat-container .bsc-header-details-text-title {\n  transform: none;\n  color: #fff;\n  font-size: 16px;\n  font-weight: 400;\n}\n#bsc-chat-container .bsc-header-action-minimize-icon {\n  mask-image: url(\"https://webchat-themes.ng.botschool.ai/private-themes/botschool2.0/icons/minimize.svg\");\n  -webkit-mask-image: url(\"https://webchat-themes.ng.botschool.ai/private-themes/botschool2.0/icons/minimize.svg\");\n  background-color: #fff;\n}\n#bsc-chat-container .bsc-header-action-minimize-icon:hover {\n  opacity: 1;\n}\n#bsc-chat-container .bsc-header-action-close-icon {\n  mask-image: url(\"https://webchat-themes.ng.botschool.ai/private-themes/botschool2.0/icons/close.svg\");\n  -webkit-mask-image: url(\"https://webchat-themes.ng.botschool.ai/private-themes/botschool2.0/icons/close.svg\");\n  background-color: #fff;\n}\n#bsc-chat-container .bsc-header-action-close-icon:hover {\n  opacity: 1;\n}\n#bsc-chat-container .bsc-message-list {\n  background-color: #fff;\n  overflow-y: auto;\n  overflow-x: hidden;\n}\n#bsc-chat-container .bsc-message-list::-webkit-scrollbar {\n  width: 8px;\n}\n#bsc-chat-container .bsc-message-list::-webkit-scrollbar-track {\n  background: rgba(232, 234, 237, 0.3);\n  border-radius: 10px;\n  margin: 10px 0;\n}\n#bsc-chat-container .bsc-message-list::-webkit-scrollbar-thumb {\n  background: linear-gradient(180deg, #D4A024 0%, #C8941D 100%);\n  border-radius: 10px;\n  border: 2px solid transparent;\n  background-clip: padding-box;\n}\n#bsc-chat-container .bsc-message-list::-webkit-scrollbar-thumb:hover {\n  background: linear-gradient(180deg, #E5B135 0%, #D9A52E 100%);\n  background-clip: padding-box;\n}\n#bsc-chat-container .bsc-message-list .bsc-message-list-container {\n  padding: 15px 3px 10px 20px;\n  overflow: scroll;\n  overflow-x: hidden;\n}\n#bsc-chat-container .bsc-message-list .bsc-message-list-container .bsc-local .bsc-message {\n  background-color: #007aff;\n  color: white;\n  border-radius: 15px 15px 0 15px;\n}\n#bsc-chat-container .bsc-message-list .bsc-message-list-container .bsc-remote {\n  max-width: 303px;\n}\n#bsc-chat-container .bsc-message-list .bsc-message-list-container .bsc-remote .bsc-message {\n  background-color: #edeef2;\n  color: #666;\n  border-radius: 15px 15px 15px 0;\n}\n#bsc-chat-container .bsc-message-list .bsc-message-list-container .bsc-local .bsc-message,\n#bsc-chat-container .bsc-message-list .bsc-message-list-container .bsc-remote .bsc-message {\n  padding: 10px;\n  width: fit-content;\n  box-shadow: 0px 4px 4px -3px rgba(0, 0, 0, 0.25);\n}\n#bsc-chat-container .bsc-message-list .bsc-message-list-container .bsc-local .bsc-message .dot-1, #bsc-chat-container .bsc-message-list .bsc-message-list-container .bsc-local .bsc-message .dot-2, #bsc-chat-container .bsc-message-list .bsc-message-list-container .bsc-local .bsc-message .dot-3,\n#bsc-chat-container .bsc-message-list .bsc-message-list-container .bsc-remote .bsc-message .dot-1,\n#bsc-chat-container .bsc-message-list .bsc-message-list-container .bsc-remote .bsc-message .dot-2,\n#bsc-chat-container .bsc-message-list .bsc-message-list-container .bsc-remote .bsc-message .dot-3 {\n  background-color: #007aff;\n}\n#bsc-chat-container .bsc-message-list .bsc-message-list-container .bsc-local .bsc-message-menuButtons-title,\n#bsc-chat-container .bsc-message-list .bsc-message-list-container .bsc-remote .bsc-message-menuButtons-title {\n  padding: 0 0 8px 0;\n}\n#bsc-chat-container .bsc-message-list .bsc-message-list-container .bsc-local .bsc-message-menuButtons-vertical button, #bsc-chat-container .bsc-message-list .bsc-message-list-container .bsc-local .bsc-message-menuButtons-horizontal button, #bsc-chat-container .bsc-message-list .bsc-message-list-container .bsc-local .bsc-message-menuButtons-grid button,\n#bsc-chat-container .bsc-message-list .bsc-message-list-container .bsc-remote .bsc-message-menuButtons-vertical button,\n#bsc-chat-container .bsc-message-list .bsc-message-list-container .bsc-remote .bsc-message-menuButtons-horizontal button,\n#bsc-chat-container .bsc-message-list .bsc-message-list-container .bsc-remote .bsc-message-menuButtons-grid button {\n  line-height: 21px;\n  padding: 0.25rem 0.5rem;\n  border-radius: 6px;\n  color: white;\n  background-color: #007aff;\n  border: inherit;\n  border-color: #007aff;\n  transition: color 0.15s ease-in-out, background-color 0.15s ease-in-out, border-color 0.15s ease-in-out, box-shadow 0.15s ease-in-out;\n}\n#bsc-chat-container .bsc-message-list .bsc-message-list-container .bsc-local .bsc-message-menuButtons-vertical :hover, #bsc-chat-container .bsc-message-list .bsc-message-list-container .bsc-local .bsc-message-menuButtons-horizontal :hover, #bsc-chat-container .bsc-message-list .bsc-message-list-container .bsc-local .bsc-message-menuButtons-grid :hover,\n#bsc-chat-container .bsc-message-list .bsc-message-list-container .bsc-remote .bsc-message-menuButtons-vertical :hover,\n#bsc-chat-container .bsc-message-list .bsc-message-list-container .bsc-remote .bsc-message-menuButtons-horizontal :hover,\n#bsc-chat-container .bsc-message-list .bsc-message-list-container .bsc-remote .bsc-message-menuButtons-grid :hover {\n  background-color: #8779e7;\n}\n#bsc-chat-container .bsc-footer {\n  padding: 0px;\n  position: relative;\n  background-color: #EDEEF2;\n  border-radius: 0 0 15px 15px;\n  flex: 55px 0 0;\n}\n#bsc-chat-container .bsc-footer #bsc-footer-zones .bsc-footer-zone-1 {\n  flex: 40px 0 0;\n  background-color: transparent;\n  border: none;\n  background: linear-gradient(90deg, #9059f7 3%, #de6af7 100%);\n  border-radius: 50%;\n  font-size: 22px;\n  padding: 0;\n  transition: transform 0.3s;\n  margin-right: 10px;\n}\n#bsc-chat-container .bsc-footer #bsc-footer-zones .bsc-footer-zone-1:hover {\n  transform: scale(1.1);\n}\n#bsc-chat-container .bsc-footer #bsc-footer-actions #bsc-send-button {\n  border: none;\n  background-color: #007aff;\n  margin-right: 5px;\n  margin-left: 10px;\n}\n#bsc-chat-container .bsc-footer #bsc-footer-actions #bsc-send-button:hover {\n  background-color: #8779e7;\n}\n\n.bsc-chat-minimized {\n    background-image: url(\"https://webchat-themes.ng.botschool.ai/private-themes/botschool2.0/images/default_student.jpg\");\n    background-repeat: no-repeat, no-repeat;\n    background-size: cover;\n    background-position: 50% 50%;\n    box-shadow: 0px 5px 2px rgba(0, 0, 0, 0.25);\n    bottom: 70px;\n    right: 25px;\n}\n\n.bsc-chat-minimized .bsc-text-container{\n    display: none !important;\n}\n/* SHADOW DOM STYLES END */"
}